,Título,Marca,Preço sem Desconto,Preço com Desconto,ID,SKU
0,DUCRAY ANAPHASE SH 200ML,LABORATORIO PIERRE FABRE,,"R$ 115,99",4389256,92964
1,MASCARA DE TRATAMENTO PANTENE COLAGENO 550ML,PANTENE,,"R$ 32,65",9992641,105364
2,Serum Concentrado Hidratante e Fortalecedor Bioderma Hy...,NAOS BRASIL,,"R$ 109,90",4079937,98732
3,AGUA MICELAR BIODERMA SEBIUM OLEOSA 100ML,NAOS BRASIL,,"R$ 45,90",4079913,93673
4,AGUA MICELAR BIODERMA SENSIBIO PELE SENSIVEL 250ML,NAOS BRASIL,,"R$ 89,90",4079934,97947
5,CREME DS+ SENSIBIO BIODERMA 40ML,BIODERMA,,"R$ 138,90",9992627,105497
6,GEL MOUSSANT BIODERMA SENSIBIO PELE SENSIVEL 200ML,NAOS BRASIL,,"R$ 98,90",4079920,93669
7,AGUA MICELAR BIODERMA SENSIBIO PELE SENSIVEL 500ML,NAOS BRASIL,,"R$ 119,90",4079915,93667
8,CREME AR BIODERMA SENSIBIO 40ML,NAOS BRASIL,,"R$ 144,90",4079916,93666
9,GEL CREME ATODERM BIODERMA INTENSIVE 500ML,BIODERMA,,"R$ 179,90",9992731,105915
10,PROTETOR SOLAR PHOTODERM COVER TOUCH FPS50 CLARA 40GR,NAOS BRASIL,,"R$ 105,59",9993749,106424
12,SENSIBIO GEL TUBO BIODERMA 100ML,BIODERMA,,"R$ 74,90",4079938,98731
13,SERUM BIODERMA HYDRABIO H2O 250ML,NAOS BRASIL,,"R$ 81,90",4079904,90792
14,AGUA MICELAR BIODERMA SENSIBIO PELE SENSIVEL 100ML,NAOS BRASIL,,"R$ 54,90",4078903,93662
15,BAUME ATODERM BIODERMA INTENSIVE 200ML,NAOS BRASIL,,"R$ 110,90",4078985,93661
16,BIODERMA ATODERM BARRA 150G,NAOS BRASIL,,"R$ 57,90",4079902,90796
17,BIODERMA GEL SEBIUM MOUSSANT 200ML,NAOS BRASIL,,"R$ 70,90",9993647,105498
18,CREME ATODERM BIODERMA ULTRA 200ML,NAOS BRASIL,,"R$ 79,90",4079931,97508
19,CREME BIODERMA CICABIO 40ML,NAOS BRASIL,,"R$ 62,90",9992920,105495
20,FORTALECEDOR DE MAOS E UNHAS ATODERM BIODERMA 50ML,BIODERMA,,"R$ 64,49",4079928,97215
21,OLEO BANHO ATODERM BIODERMA 200ML,NAOS BRASIL,,"R$ 112,90",4078603,99223
22,PIGMENTBIO BIODERMA SENSIVEL 75ML,NAOS BRASIL,,"R$ 135,90",9993750,105501
23,PROTETOR SOLAR PHOTODERM COVER TOUCH FPS50 40GR,NAOS BRASIL,,"R$ 94,90",4079906,90797
24,SEBIUM BIODERMA PORE REFINER 30ML,NAOS BRASIL,,"R$ 115,90",4079907,90798
25,SHAMPOO NODE BIODERMA DS+ANTICASPA 125ML,NAOS BRASIL,,"R$ 99,90",9993448,105486
26,PROTETOR SOLAR FACIAL ADCOS STICK NUDE FPS55 17G,ADCOS,,"R$ 169,00",9993449,105485
27,PROTETOR SOLAR FACIAL ADCOS STICK PEACH FPS55 17G,ADCOS,,"R$ 169,00",9991093,103778
28,PROTETOR SOLAR MOUSSE ADCOS MINERAL FPS50 PEACH 50G,ADCOS,,"R$ 169,00",9991094,103779
29,SERUM ADCOS MELAN-OFF CONCENTRADO CLAREADOR 30G,ADCOS,,"R$ 299,00",9991066,103749
30,DERMA COMPLEX ADCOS VITAMINA C20 15ML,ADCOS,,"R$ 199,00",9991065,103748
31,HIDRATANTE FACIAL ADCOS AQUA SERUM 30ML,ADCOS,,"R$ 199,00",9993185,105240
32,PROTETOR SOLAR FACIAL ADCOS STICK PEACH FPS80 17G,ADCOS,,"R$ 169,00",9991195,103881
33,SERUM ADCOS VITAMINA C15 + ACIDO HIALURONICO 15ML,ADCOS,,"R$ 199,00",1258024,84712
34,MANTEIGA DE CACAU LUXO NATURAVENE UNID**,NATURAVENE,,"R$ 4,90",7659918,97475
35,FISIOGEL LOC 100ML,MEGALABS FARMACEUTICA DERMO,,"R$ 56,90",258633,68517
36,CETAPHIL LOCAO HIDRATANTE PELE NORMAL SECA 473ML,GALDERMA BRASIL-DERMO,"R$ 109,90","R$ 99,90",8889927,85633
37,LENCO DEMAQUILANTE NIVEA AZUL 3X1 C/25UNID **,BDF NIVEA LTDA,,"R$ 25,49",7658801,82216
38,FISIOGEL LOC AI 200ML,MEGALABS FARMACEUTICA DERMO,,"R$ 158,90",9990133,102809
39,CERAVE CREME HIDRATANTE SEM PERFUME PELE SECA A EXTRA S...,LOREAL BR- DIV DCA LA ROCHE,"R$ 36,90","R$ 33,90",8884329,85594
40,CREME DE MAOS NIVEA HAND Q10 75G 6290,BDF NIVEA LTDA,,"R$ 20,90",4764202,83740
41,LA ROCHE KERIUM DS SHAMPOO ANTICASPA INTENSIVO 125ML,LOREAL BR- DIV DCA LA ROCHE,,"R$ 117,17",4388818,93496
42,AGUA THERMAL AVENE 300ML,LABORATORIO PIERRE FABRE,,"R$ 120,90",7098632,98532
43,CREME FACIAL REVITALIFT HIALURONICO NOTURNO,LOREAL BR- DIV DPGP CAPILAR,"R$ 60,30","R$ 49,90",4769915,83728
44,LA ROCHE EFFACLAR GEL DE LIMPEZA PROFUNDA CONCENTRADO 6...,LOREAL BR- DIV DCA LA ROCHE,,"R$ 49,99",4769938,96655
45,LA ROCHE KERIUM SHAMPOO ANTICASPA 200G,LOREAL BR- DIV DCA LA ROCHE,,"R$ 114,90",3308663,95963
46,NEUTROGENA HYDRO BOOST GEL HIDRATANTE FACIAL WATER 50G,JOHNSON & JOHNSON-HIGIENE,,"R$ 87,30",7094903,93020
47,SKINCEUTICALS BLEMISH+AGE 125ML 9297,LOREAL BR- DIV DCA SKINCEUTICA,,"R$ 103,91",4769956,98399
48,CERAVE CREME HIDRATANTE CORPORAL SEM PERFUME PELE SECA ...,LOREAL BR- DIV DCA LA ROCHE,,"R$ 142,65",4769569,97076
49,CERAVE LOÇAO HIDRATANTE FACIAL SEM PERFUME PELE NORMAL ...,LOREAL BR- DIV DCA LA ROCHE,,"R$ 96,90",9991507,104199
50,CREME SERUM FACIAL NIVEA CELLULAR LUMINOUS NOITE 630° 3...,NIVEA,"R$ 135,90","R$ 99,90",7659919,97476
51,FISIOGEL LOCAO A.I 100ML,MEGALABS FARMACEUTICA DERMO,,"R$ 132,90",4768697,95227
52,LA ROCHE EFFACLAR SABONETE CONCENTRADO 70GR,LOREAL BR- DIV DCA LA ROCHE,,"R$ 52,90",4769937,96576
53,LA ROCHE HYALU B5 REPAIR SERUM ANTI-IDADE 30ML,LOREAL BR- DIV DCA LA ROCHE,,"R$ 256,90",585001,88927
54,SKINCEUTICALS C E FERULIC 15ML 0491,LOREAL BR- DIV DCA SKINCEUTICA,,"R$ 370,75",498812,88109
55,ACTINE SAB BARRA 80GR 1411,DARROW,,"R$ 37,99",4769577,99097
56,CERAVE GEL DE LIMPEZA FACIAL 454G,LOREAL BR- DIV DCA LA ROCHE,,"R$ 99,90",4769954,98269
57,CERAVE LOÇAO HIDRATANTE SEM PERFUME PELE SECA A EXTRA S...,LOREAL BR- DIV DCA LA ROCHE,,"R$ 101,68",253101,68497
58,CETAPHIL CREME HIDRATANTE CORPO PELE SECA E SENSIVEL 45...,CETAPHIL,,"R$ 114,90",9990841,103520
59,DERSANI 200ML LV3 PG2,MEGALABS FARMACEUTICA SA-OTC,,"R$ 199,80",9993077,105118
60,GEL HIDRATANTE CORPO NEUTROGENA HYDRO BOOST WATER 400ML,NEUTROGENA,"R$ 62,99","R$ 45,90",4769945,97742
61,LA ROCHE EFFACLAR BB BLUR CLARA UNIFICADOR 20ML,LOREAL BR- DIV DCA LA ROCHE,"R$ 147,90","R$ 135,90",9992126,104848
62,LA ROCHE EFFACLAR GEL DE LIMPEZA FACIAL ALTA TOLERANCIA...,LA ROCHE - POSAY,,"R$ 98,90",9990710,103389
63,LOC HIDR CORPORAL THERASKIN KLAVIE CLINICAL 390ML,THERASKIN,,"R$ 69,90",3309918,97312
64,NEUTROGENA ESFOLIANTE FACIAL PURIFIED SKIN 100G,JOHNSON & JOHNSON-HIGIENE,,"R$ 58,40",4299903,98215
65,SERUM CLAREADOR THERASKIN KLASSIS TX+PUMP 30GR,THERASKIN,"R$ 179,00","R$ 159,90",9991203,103889
66,SERUM FACIAL SKINCEUTICALS BLEMISH + AGE DEFENSE 15ML,LOREAL,,"R$ 219,90",7094904,88930
67,SKINCEUTICALS GEL DE LIMPEZA BLEMISH+AGE CLESING 120G,LOREAL BR- DIV DCA SKINCEUTICA,,"R$ 100,90",6839905,88929
68,SKINCEUTICALS SERUM DISCOL DEF 30ML 6912,LOREAL BR- DIV DCA SKINCEUTICA,,"R$ 299,90",4764970,97093
69,SKINCEUTICALS UV OIL DEFENSE FPS80 40G,LOREAL BR- DIV DCA SKINCEUTICA,,"R$ 126,90",2048401,66502
70,ACNASE CREME 25GR,BIOLAB,,"R$ 49,89",4778801,67419
71,AGUA THERMAL AVENE 150ML,LABORATORIO PIERRE FABRE,,"R$ 112,90",4388819,93497
72,AGUA THERMAL AVENE 50ML,LABORATORIO PIERRE FABRE,,"R$ 84,90",4388804,67433
73,AVENE LOCAO HIDRATANTE TRIXERA NUTRI-FLUIDA 200ML,LABORATORIO PIERRE FABRE,,"R$ 72,90",4769963,98984
74,CERAVE CREME HIDRATANTE CORPORAL SEM PERFUME PELE SECA ...,LOREAL BR- DIV DCA LA ROCHE,,"R$ 79,90",255160,96173
75,CETAPHIL LOCAO HIDRATANTE ADVANCED MOIST 473GR 6067,GALDERMA BRASIL-DERMO,,"R$ 110,49",7429904,93781
76,CETAPHIL SAB LIQ RESTORAD 295ML,GALDERMA BRASIL-DERMO,,"R$ 105,90",8038901,95489
77,CREME FACIAL REVITALIFT LASER 3X NOTURNO 50ML,LOREAL BR- DIV DPGP CAPILAR,,"R$ 81,90",4410601,82026
78,EXIMIA FORTALIZE 30CPR,FARMOQUIMICA,,"R$ 153,90",9991959,104681
79,GEL CLEANANCE AVENE LIMPEZA PURIFICANTE 300ML,AVENE,,"R$ 95,90",4299586,83686
80,Gel-Creme Profuse Nutrel Suavizante Balm 50g,ACHE,,"R$ 71,90",1258939,96853
81,KLASSIS EMULGEL CLAREADOR FPS20 30G,THERASKIN,,"R$ 206,00",4769565,83722
82,KLAVIE CLINICAL LOC HIDRATANTE 190ML,THERASKIN,,"R$ 46,99",4769943,97177
83,LA ROCHE AGUA TERMAL 150G,LOREAL BR- DIV DCA LA ROCHE,,"R$ 117,90",4768671,97095
84,LA ROCHE DES AERO INNOVATION 150ML 2141,LOREAL BR- DIV DCA LA ROCHE,,"R$ 117,90",4769905,83729
85,LA ROCHE EFFACLAR DUO+ CREME ANTI-IMPERFEIÇOES 40ML,LOREAL BR- DIV DCA LA ROCHE,,"R$ 178,90",4769962,98927
86,LA ROCHE EFFACLAR GEL DE LIMPEZA PROFUNDA CONCENTRADO 1...,LOREAL BR- DIV DCA LA ROCHE,"R$ 75,99","R$ 69,90",4768695,83732
87,LA ROCHE EFFACLAR GEL DE LIMPEZA PROFUNDA CONCENTRADO 3...,LOREAL BR- DIV DCA LA ROCHE,"R$ 94,95","R$ 89,90",4769902,83733
88,LA ROCHE EFFACLAR GEL DE LIMPEZA SUAVE ALTA TOLERANCIA ...,LOREAL BR- DIV DCA LA ROCHE,,"R$ 50,54",4768701,96575
89,LA ROCHE EFFACLAR MAT HIDRATANTE FACIAL 40ML,LOREAL BR- DIV DCA LA ROCHE,,"R$ 236,90",4769919,83748
90,LA ROCHE EFFACLAR SABONETE ALTA TOLERANCIA 70G,LOREAL BR- DIV DCA LA ROCHE,,"R$ 46,40",4769910,83750
91,LA ROCHE LIPIKAR BAUME AP+M 400ML,LOREAL BR- DIV DCA LA ROCHE,,"R$ 222,07",5238826,95961
92,LA ROCHE LIPIKAR LOÇAO HIDRATANTE INTENSIVO CORPORAL 40...,LOREAL BR- DIV DCA LA ROCHE,,"R$ 159,90",250260,85959
93,NEUTROGENA HIDRATANTE CORPO NORWEGIAN SEM FRAGRANCIA 50...,JOHNSON & JOHNSON-HIGIENE,,"R$ 99,90",7098631,98531
94,NUTRAPLUS 10% LOCAO 120ML,GALDERMA,,"R$ 88,07",499908,97167
95,PROTETOR SOLAR REVITALIFT HIALURONICO DIURNO FPS20,LOREAL BR- DIV DPGP CAPILAR,"R$ 59,90","R$ 49,90",9991114,103799
96,Sabonete Liquido Darrow Actine Pele Acneica 400ml,DARROW,,"R$ 96,90",7094913,91024
97,SERUM ANTI-IDADE THERASKIN EURYALE C 50G,THERASKIN,"R$ 227,00","R$ 145,99",7094907,88926
98,SKINCEUTICALS AGE EYE COMPLEX 15ML 8209,LOREAL BR- DIV DCA SKINCEUTICA,,"R$ 684,20",586101,101578
99,SKINCEUTICALS BLEMISH+AGE DEF 30ML 5504,LOREAL BR- DIV DCA SKINCEUTICA,,"R$ 299,90",589901,88934
100,SKINCEUTICALS FPS80 UV OIL DEF COR 40G 2646,LOREAL BR- DIV DCA SKINCEUTICA,,"R$ 136,90",4299584,89512
101,"SKINCEUTICALS RETIN 0,3 CR NOT 30M 0206",LOREAL BR- DIV DCA SKINCEUTICA,,"R$ 499,90",1839902,89955
102,THERACNE SAB BARRA 80GR,THERASKIN,,"R$ 49,78",4386101,98721
103,UMIDITA CREME EM GEL FACIAL FPS25 50ML,LIBBS,,"R$ 67,90",4389241,67439
104,AVENE FPS60 MAT PERF ANTIACNE 40G 2212,LABORATORIO PIERRE FABRE,,"R$ 99,99",4769579,99225
105,AVENE PROTETOR SOLAR INFANTIL SPRAY FPS50 200ML,LABORATORIO PIERRE FABRE,,"R$ 124,99",4769951,98100
106,CERAVE GEL DE LIMPEZA FACIAL 150G,LOREAL BR- DIV DCA LA ROCHE,,"R$ 59,90",7429907,98284
107,CERAVE LOÇAO HIDRATANTE SEM PERFUME PELE SECA A EXTRA S...,LOREAL BR- DIV DCA LA ROCHE,,"R$ 81,79",255157,68520
108,CETAPHIL CREME HIDRATANTE CORPO 250GR 0565,GALDERMA BRASIL-DERMO,,"R$ 79,99",7429908,98582
109,CETAPHIL LOCAO DE LIMPEZA PUMP 300ML,GALDERMA BRASIL-DERMO,,"R$ 87,90",4489903,93750
110,CETAPHIL SUN ANTIOX FPS60 COR 50ML,GALDERMA BRASIL-DERMO,,"R$ 76,90",4388811,93500
111,C-kaderm Gel 20g,HYPERA DERMO-MANTECORP,,"R$ 192,90",9009903,102471
112,CREME AVENE REPARADOR CICALFATE+40ML,LABORATORIO PIERRE FABRE,"R$ 89,90","R$ 74,90",7659920,98078
113,EUCERIN SERUM FACIAL ANTI-PIGMENT DUAL 30ML,BDF NIVEA LTDA-EUCERIN,,"R$ 355,90",4388822,96171
114,FISIOGEL CREME FACIAL A.I FPS20 40GR,MEGALABS FARMACEUTICA DERMO,,"R$ 82,19",4388821,96170
115,GEL CLEANANCE AVENE INTENSE LIMPEZA PROFUNDA 300ML,AVENE,,"R$ 99,90",4388823,96519
116,GEL CLEANANCE AVENE LIMPEZA PURIFICANTE 150M,LABORATORIO PIERRE FABRE,,"R$ 70,90",4948613,98325
117,GEL CLEANANCE AVENE LIMPEZA PURIFICANTE 60GR,LABORATORIO PIERRE FABRE,,"R$ 49,90",349901,92760
118,GEL SECATIVO ASEPXIA TRANSPARENTE 15G,GENOMMA PERFUMARIA,,"R$ 22,90",8828817,83085
119,HELIORAL MELORA 250MG C/60CPS 3021,FARMOQUIMICA,,"R$ 187,82",9990380,103054
120,KIT VERÃO AVÉNE MAT PERFECT FLUIDO COM COR FPS60 40G + ...,LABORATORIO PIERRE FABRE,,"R$ 70,90",4769903,83755
121,LA ROCHE CREME PURE VITAMINA C ANTI-IDADE 40ML,LOREAL BR- DIV DCA LA ROCHE,,"R$ 277,90",9989930,102609
122,LA ROCHE CREME PURE VITAMINA C UV FPS25 ANTI-IDADE 40ML,LOREAL BR- DIV DCA LA ROCHE,,"R$ 288,90",4768694,83731
123,LA ROCHE EFFACLAR GEL DE LIMPEZA SUAVE ALTA TOLERANCIA ...,LOREAL BR- DIV DCA LA ROCHE,,"R$ 75,99",4768933,98459
124,LA ROCHE HYALU B5 OLHOS CUIDADO REPARADOR 15ML,LOREAL BR- DIV DCA LA ROCHE,,"R$ 201,90",4769950,98116
125,LA ROCHE HYALU B5 REPAIR CREME ANTI-IDADE 40ML,LOREAL BR- DIV DCA LA ROCHE,,"R$ 299,90",4798961,95229
126,LA ROCHE LIPIKAR BAUME AP+M 75ML,LOREAL BR- DIV DCA LA ROCHE,,"R$ 121,48",4768916,91086
127,LA ROCHE LIPIKAR LOCAO HIDRATANTE INTENSIVO CORPORAL 20...,LOREAL BR- DIV DCA LA ROCHE,,"R$ 99,90",4768693,83757
128,LA ROCHE REDERMIC HYALU C OLHOS CREME ANTI-IDADE 15ML,LOREAL BR- DIV DCA LA ROCHE,,"R$ 226,90",4768890,83766
129,LA ROCHE TOLERIANE SENSITIVE HIDRATANTE 40ML,LOREAL BR- DIV DCA LA ROCHE,,"R$ 139,90",9993196,105251
130,LOCAO HIDRATANTE NUTRIOL MED ANTICOCEIRA 100ML,DARROW,,"R$ 82,90",348904,92756
131,PROFUSE ESSENCELE FILER C SERUM 30G,ACHE,,"R$ 183,90",349910,92761
132,Profuse Puriance Gel Renovador Para Pele Oleosa 60g,ACHE,,"R$ 76,90",4389255,67437
133,PROTETOR SOLAR FACIAL AVENE FPS50+PO COMPACTO DORE 50G,LABORATORIO PIERRE FABRE,,"R$ 169,99",4389240,67438
134,PROTETOR SOLAR FACIAL AVENE FPS50+PO COMPACTO SABLE 10G...,LABORATORIO PIERRE FABRE,,"R$ 169,99",4389910,97165
135,PROTETOR SOLAR FACIAL AVENE FPS60 MAT PERFECT S/COR 40G...,LABORATORIO PIERRE FABRE,"R$ 99,99","R$ 86,90",4388615,98911
136,PROTETOR SOLAR FACIAL AVENE FPS70 EMULSAO COLOR 40G,LABORATORIO PIERRE FABRE,,"R$ 77,99",4388616,98912
137,PROTETOR SOLAR FACIAL AVENE FPS70 EMULSAO S/COR 40GR,LABORATORIO PIERRE FABRE,,"R$ 77,99",4389905,93506
138,"Protetor Solar Facial Avene Mat Perfect com cor, FPS 60...",LABORATORIO PIERRE FABRE,,"R$ 99,99",9991598,104294
139,SERUM ANTI ACNE AVENE CLEANANCE COMEDOMED 30ML,AVENE,,"R$ 214,90",589906,93026
140,SKINCEUTICALS PHLORETIN C F GOTAS 30ML,LOREAL BR- DIV DCA SKINCEUTICA,,"R$ 499,90",7094906,88935
141,SKINCEUTICALS SERUM 10 30ML 0997,LOREAL BR- DIV DCA SKINCEUTICA,,"R$ 419,90",4778667,91472
142,DESODORANTEVICHY 48HORAS VERDE 50ML,LOREAL BR- DIV DCA VICHY,,"R$ 133,90",4779923,96682
143,VICHY HID MINERAL 89 30ML,LOREAL BR- DIV DCA VICHY,"R$ 129,15","R$ 122,90",4778661,91425
144,Protetor Solar Corporal Vichy Idéal Soleil Hydrasoft FP...,LOREAL BR- DIV DCA VICHY,,"R$ 113,90",9991008,103691
145,PROTETOR SOLAR FACIAL VICHY FPS70 IDEAL SOLEIL MEDIO 40...,LOREAL,,"R$ 88,90",9990048,102723
146,VICHY DERCOS SHAMPOO MICROPEEL ANTICASPA 150G,LOREAL BR- DIV DCA VICHY,,"R$ 89,90",4778901,93310
147,Desodorante Vichy Cremeso 7 dias 30ml,LOREAL BR- DIV DCA VICHY,,"R$ 139,90",4778635,90259
148,Normaderm Vichy Loção Tônica Adstringente 200ml,LOREAL BR- DIV DCA VICHY,"R$ 189,76","R$ 175,90",4774603,98729
149,Shampoo Vichy Dercos Kera-Solutions 300mL,LOREAL BR- DIV DCA VICHY,,"R$ 92,90",4778622,90247
150,VICHY DESODORANTE ROLL-ON 48H PARA PELES SENSIVEIS 50ML,LOREAL BR- DIV DCA VICHY,,"R$ 139,90",4778675,96615
151,VICHY NORMADERM GEL DE LIMPEZA PROFUNDA PELE MISTA A OL...,VICHY,,"R$ 65,90",4778671,93311
152,VICHY SERUM MINERAL 89 HIDRATANTE FACIAL 50ML,LOREAL BR- DIV DCA VICHY,,"R$ 199,90",4775701,98727
153,Condicionador Vichy Dercos Kera-Solutions 200mL,LOREAL BR- DIV DCA VICHY,,"R$ 89,90",4779911,90246
154,Desodorante Roll-On Vichy Ideal Finish 30ml,LOREAL BR- DIV DCA VICHY,,"R$ 132,90",4776104,98845
155,IDEAL SOLEIL VICHY HYDRASOFT FPS70 200ML,LOREAL BR- DIV DCA VICHY,,"R$ 124,90",4778904,91426
156,Loção Sérum Corporal Vichy Ideal Body Hidratante Anti-i...,LOREAL BR- DIV DCA VICHY,,"R$ 186,90",4779926,97172
157,"Protetor Solar Vichy Ideal Soleil Clarify claro, FPS 60...",LOREAL BR- DIV DCA VICHY,,"R$ 98,65",4778676,96927
158,Tratamento Antiacne Vichy Normaderm Skin Corrector 30m,LOREAL BR- DIV DCA VICHY,,"R$ 154,90",4778641,90233
159,VICHY AGUA TERMAL 50ML,LOREAL BR- DIV DCA VICHY,,"R$ 94,90",4779902,90253
160,VICHY DERCOS MASCARA CAPILAR KERA SOLUTIONS 200ML,LOREAL BR- DIV DCA VICHY,,"R$ 139,90",4778655,93322
161,Vichy Dercos Shampoo Anticaspa Intensivo 200ml,LOREAL BR- DIV DCA VICHY,,"R$ 102,90",9991453,104145
162,VICHY DERCOS SHAMPOO REFIL ENERGIZANTE 200ML,VICHY,,"R$ 83,90",4778677,97169
163,VICHY DERCOS SUPER AMPOLA ENERGIZANTE 40ML,LOREAL BR- DIV DCA VICHY,,"R$ 59,55",4778666,91790
164,VICHY DESODORANTE ANTITRANSPIRANTE STRESS RESIST 50ML,LOREAL BR- DIV DCA VICHY,,"R$ 139,90",9990141,102817
165,VICHY LIFTACTIV SERUM COM AÇAO PRO-COLAGENO PEPTIDE-AHA...,LOREAL BR- DIV DCA VICHY,,"R$ 249,90",9990179,102855
166,VICHY SERUM MINERAL 89 CONCENTRADO PARA OLHOS 15ML,LOREAL BR- DIV DCA VICHY,,"R$ 219,24",4779931,97175
167,Creme Anti-Idade Area dos Olhos Liftactiv Vichy Supreme...,LOREAL BR- DIV DCA VICHY,,"R$ 198,10",4778678,98473
168,Gel de Limpeza Profunda Vichy Normaderm 1 unidade com 3...,LOREAL BR- DIV DCA VICHY,,"R$ 93,90",4778664,91463
169,Normaderm Gel Limpeza 60g,LOREAL BR- DIV DCA VICHY,,"R$ 50,15",4778606,90263
170,Shampoo Dercos Energizante Antiqueda 200ml,LOREAL BR- DIV DCA VICHY,,"R$ 110,90",4778670,93323
171,VICHY DERCOS SHAMPOO ANTICASPA E COURO CABELUDO SENSIVE...,LOREAL BR- DIV DCA VICHY,,"R$ 108,90",4779922,96096
172,VICHY DERCOS SHAMPOO ENERGY+ANTI QUEDA 400ML,LOREAL BR- DIV DCA VICHY,,"R$ 157,90",4778657,91473
173,VICHY ESPUMA DE LIMPEZA PURETE THERMALE 150ML,LOREAL BR- DIV DCA VICHY,,"R$ 141,35",4779927,97173
174,VICHY IDEAL SOLEIL PROTETOR SOLAR FACIAL CLARIFY COR ME...,LOREAL BR- DIV DCA VICHY,,"R$ 98,65",4779930,97171
175,VICHY IDEAL SOLEIL PROTETOR SOLAR FACIAL EFEITO BASE CO...,LOREAL BR- DIV DCA VICHY,,"R$ 74,90",4774907,93317
176,VICHY LIFTACTIV ANTI-IDADE RETINOL HA ADVANCED 30ML,LOREAL BR- DIV DCA VICHY,,"R$ 355,90",4778669,93319
177,VICHY NEOVADIOL 50ML,LOREAL BR- DIV DCA VICHY,,"R$ 269,90",4778679,98641
178,VICHY NEOVADIOL PHYTOSCULPT 50ML 7182,LOREAL BR- DIV DCA VICHY,,"R$ 285,90",514301,67703
179,BEPANTOL DERMA MULTIRRESTAURADOR 20G,BAYER,,"R$ 29,90",9991110,103795
180,LOCAO CORPORAL BEPANTOL DERMA HIDRATANTE RESTAURADOR 40...,BEPANTOL,"R$ 99,90","R$ 69,90",514901,67705
181,"BEPANTOL DERMA LABIAL 7,5ML*",BAYER,,"R$ 35,90",9990595,103271
182,"BEPANTOL DERMA LABIAL FPS50 4,5G",BAYER,,"R$ 34,90",514303,93640
183,BEPANTOL DERMA SPRAY 50ML*,BAYER,,"R$ 29,90",9991109,103794
184,LOCAO CORPORAL BEPANTOL DERMA HIDRATANTE RESTAURADOR 20...,BEPANTOL,"R$ 64,90","R$ 59,90",514304,93639
185,BEPANTOL DERMA 40G.,BAYER,,"R$ 57,90",9991106,103791
186,GEL FACIAL DIARIO BEPANTOL DERMA LIMPEZA DELICADA 200ML,BEPANTOL,,"R$ 57,90",9991108,103793
187,LOCAO FACIAL NOTURNA BEPANTOL DERMA 50ML,BEPANTOL,,"R$ 64,90",5719929,97714
188,LOCAO HIDRATANTE UREADIN ISDIN 10% 200ML,ISDIN,,"R$ 70,40",5719906,91145
189,CREME DE PES UREADIN ISDIN PODOS GEL OIL 75ML,ISDIN,,"R$ 77,90",5714901,94984
190,ISDIN FPS50 FUSION FLUID MINER 50M 5214,ISDIN,,"R$ 104,90",5719930,97788
191,LOCAO HIDRATANTE UREADIN ISDIN 10% PUMP 400GR,ISDIN,,"R$ 106,90",9993012,105059
192,PROTETOR SOLAR GEL CREAM ISDIN FPS50 198GR,ISDIN,,"R$ 78,90",9993015,105062
193,PROTETOR SOLAR ISDIN FPS60 FUSION WATER OIL CONTROL 30M...,ISDIN,,"R$ 69,90",9993011,105058
194,AGUA MICELAR ISDIN SOLUTION 400ML,ISDIN,,"R$ 90,90",9991612,104308
195,CREME ANTI-IDADE PARA AREA DOS OLHOS ISDINCEUTICS K-OX ...,ISDIN,,"R$ 229,90",5719913,91144
196,"CREME DE MAOS UREADIN ISDIN 51,5G 3349",ISDIN,,"R$ 66,90",5718902,93281
197,CREME DE PES UREADIN ISDIN PODOS DIABETE 102G,ISDIN,,"R$ 100,90",9991704,104406
198,LOCAO HIDRATANTE ISDIN UREADIN 10 DE UREIA PELE SECA 10...,ISDIN,,"R$ 34,90",5719923,97210
199,PROTETOR SOLAR ISDIN FPS50 AGE REPAIR ULTRA FUSION WATE...,ISDIN,"R$ 149,90","R$ 143,90",9991773,104483
200,SERUM FACIAL ISDINCEUTICS FLAVO-C ULTRAGLICAN C/10 UNI,ISDIN,,"R$ 174,90",9993008,105055
201,"CANETA FORTALECEDORA DE UNHAS ISDIN SI NAIL 2,5ML",ISDIN,,"R$ 126,47",5718606,98647
202,CREME ANTIESTRIAS ISDIN WOMAN HIDRATANTE 250ML,ISDIN,,"R$ 136,90",5719918,94988
203,GEL CR FACIAL ISDIN NUTRADEICA PELE DESCAMATIVA 50ML,ISDIN,,"R$ 121,90",5719922,93276
204,GEL DE BANHO UREADIN ISDIN 424GR,ISDIN,,"R$ 77,90",9991703,104405
205,HIDRATANTE GEL DE BANHO ISDIN UREADIN 100ML,ISDIN,,"R$ 29,90",5719924,97211
206,PROTETOR SOLAR CORPO ISDIN FPS50 HYDRO LOTION 200ML,ISDIN,"R$ 120,90","R$ 110,90",5719911,94985
207,PROTETOR SOLAR ISDIN FPS99 ACTIVE UNIFY COLOR 50M 8581*,ISDIN,,"R$ 136,90",4768921,92387
208,ANTHELIOS FPS70 XL CORPO 120ML 4231,LOREAL BR- DIV DCA LA ROCHE,,"R$ 103,90",4768922,92379
209,ANTHELIOS PROTETOR SOLAR DERMO-PEDIATRICS INFANTIL FPS6...,LOREAL BR- DIV DCA LA ROCHE,,"R$ 124,90",4768889,67080
210,ANTHELIOS PROTETOR SOLAR FPS50 AE PIGMENTATION COR CLAR...,LOREAL BR- DIV DCA LA ROCHE,,"R$ 96,40",9992053,104775
211,AVENE SAB CLEANANCE INTENSE GEL DE LIMPEZA PROFUNDA 60G,AVENE,,"R$ 50,90",3866105,98755
212,Kit Protetor Solar Corporal Nivea Sun Protect & Hidrata...,BDF NIVEA-SOLAR,"R$ 58,90","R$ 51,90",9993849,106518
213,PROTETOR SOLAR FACIAL VICHY UV AGE DAILY FPS60 3EM1 N.2...,LOREAL BR- DIV DCA VICHY,,"R$ 100,79",4769913,67081
214,ANTHELIOS FPS50 BB CREAM 40G,LOREAL BR- DIV DCA LA ROCHE,,"R$ 96,90",4944202,83718
215,LAKESIA ANTIMICOTICO 30ML,GENOMMA PERFUMARIA,,"R$ 46,90",9991848,104572
216,PROTETOR SOLAR FACIAL ACTINE DARROW FPS80 UNIVERSAL 40G...,DARROW,,"R$ 89,90",4766108,99216
217,PROTETOR SOLAR FACIAL ANTHELIOS FPS60 XL PROTECT 40G,LOREAL BR- DIV DCA LA ROCHE,,"R$ 79,90",4766540,92386
218,PROTETOR SOLAR FACIAL ANTHELIOS FPS70 PROTECT 200ML,LOREAL BR- DIV DCA LA ROCHE,,"R$ 119,90",,
