,Título,Marca,Preço sem Desconto,Preço com Desconto,ID,SKU
326,PRES JONTEX C/6 SENSITIVE 0016,RECKITT BENCKISER,,"R$ 17,89",8888103,92736
327,PRES JONTEX C/6 ULTRA MAIOR RESIST,RECKITT BENCKISER,,"R$ 13,99",7169924,97323
328,APIS FLORA PROPOMAX EXT PROP 30ML 1317,APIS FLORA,,"R$ 22,90",5848206,67167
329,MEL PROPOLIS SCHRAIBER SPRAY 35ML,SCHRAIBER,,"R$ 18,99",4698302,84913
330,MEL PROPOLIS ROMA SCHRAIBER SPRAY 35ML,SCHRAIBER,,"R$ 19,90",4698301,84912
331,APIS FLORA APIGEN ORGANICO SPRAY 30ML,APIS FLORA,,"R$ 12,90",9992605,105849
332,APIS FLORA APIROMA ORGANICO SPRAY 30ML,APIS FLORA,,"R$ 12,90",9992607,105851
333,APIS FLORA PROPOLIS PROPOMAX KIDS LARANJA SPRAY 30ML,APIS FLORA,,"R$ 16,89",9993712,106389
334,APIS FLORA MEL ABELHA SACHE 40GR 0016,APIS FLORA,,"R$ 5,10",3248801,84909
335,EXTRATO PROP VERDE 70 30ML,APIS FLORA,,"R$ 39,90",5842802,94528
336,APIS FLORA BALA GENGIBRE CANELA 40G,APIS FLORA,,"R$ 4,99",5843103,67158
337,MEL BISNAGA APIS FLORA 340G,APIS FLORA,,"R$ 28,89",5848215,67163
338,APIS FLORA APILIMAO ORGANICO SPRAY 30ML,APIS FLORA,,"R$ 12,90",9991948,104670
339,APIS FLORA EXTRATO PROPOLIS VERDE 30ML,APIS FLORA,,"R$ 29,50",5848224,92422
340,MEL PROPOLIS AGRIAO GUACO 300G,SCHRAIBER,,"R$ 27,05",4692907,84911
341,APIS FLORA BALA GENGIBRE 01483,APIS FLORA,,"R$ 4,99",5843102,67157
342,APIS FLORA EXTRATO PROPOLIS 30ML 00008,APIS FLORA,,"R$ 18,29",5848207,67165
343,APIS FLORA PROPOMAX ZERO SPRAY 30ML,APIS FLORA,,"R$ 10,33",5848208,67168
344,APIS FLORA APIGUACO SPRAY 30ML 00029,APIS FLORA,,"R$ 10,33",5848211,67151
345,APIS FLORA APIGEN SPRAY 30ML 00045,APIS FLORA,,"R$ 10,33",5848217,67150
346,APIS FLORA APIROMA SPRAY 30ML,APIS FLORA,,"R$ 10,33",5848210,67155
347,APIS FLORA BALA GENG/MEL/PROPOL 40G,APIS FLORA,,"R$ 4,99",5848601,92417
348,APIS FLORA MEL SACHE 40G,APIS FLORA,,"R$ 6,89",9993713,106390
349,MEL PROP GUACO GENG SCHAIBER SPRAY 35ML,SCHRAIBER,,"R$ 19,90",4698303,84910
350,RITMONEURAN C/20CAPS,KLEY HERTZ,,"R$ 34,21",9188704,87989
351,APIS FLORA PROPOLIS PROPOMAX KIDS UVA SPRAY 30ML,APIS FLORA,,"R$ 16,89",9993711,106388
352,EPAREMA LIQ 200ML,HYPERA PHARMA,,"R$ 69,99",218623,81227
353,NATURETTI GELEIA 130GR,HYPERA PHARMA,,"R$ 78,25",248668,85277
354,APIS FLORA APISPRAY 30ML 00015,APIS FLORA,,"R$ 10,33",5848209,67156
355,EPAREMA C/20 DRG,HYPERA PHARMA,,"R$ 39,05",218620,81224
356,PROPOMAX DIA 140ML,APIS FLORA,,"R$ 36,12",9990064,102738
357,SUNDOWN NAT ZINCO 7MG C/90,SUNDOWN NESTLE,,"R$ 78,10",3570698,89214
358,NOVANOITE PASSIFLORA 320MG C/10CPR,SANOFI +,,"R$ 23,30",9992593,105839
359,OLEO DE LINHACA 1000MGR C/60 CAPS SCHRAI,SCHRAIBER,,"R$ 38,10",4690701,86102
360,PROPOMAX EXTRATO PROPOLIS C/30 CAPS,APIS FLORA,,"R$ 35,40",5842803,98001
361,PROPOMAX NOITE 140ML,APIS FLORA,,"R$ 36,12",9990063,102737
362,SUNDOWN NAT TRIPLE OMEGA C/120CAPS,SUNDOWN NESTLE,,"R$ 239,00",3570613,89211
363,SUNDOWN VITAMINA C 1000MG C/100 CPR,SUNDOWN NESTLE,,"R$ 195,70",3570620,90314
